{
  "budget": {
    "budget_id": "default_cpu_exact.host_batch.v1",
    "budget_sha256": "b6bd47ec2aee4f880f660904f68a5aabff6cdaf35c80fde4f8aee59bf81a246c",
    "budget_version": "1.0.0"
  },
  "budget_evaluation": {
    "checks": [
      {
        "host_id": "native_cpp_direct",
        "limit": 5000.0,
        "metric": "cold_construct_ms",
        "mode": "absolute",
        "observed": 3735.714048,
        "passed": true
      },
      {
        "host_id": "native_cpp_direct",
        "limit": 5000.0,
        "metric": "warm_construct_ms",
        "mode": "absolute",
        "observed": 3714.138196,
        "passed": true
      },
      {
        "host_id": "native_cpp_direct",
        "limit": 5000.0,
        "metric": "setup_ms",
        "mode": "absolute",
        "observed": 182.479008,
        "passed": true
      },
      {
        "host_id": "native_cpp_direct",
        "limit": 5.0,
        "metric": "step_ms_per_world",
        "mode": "absolute",
        "observed": 0.13083224531249998,
        "passed": true
      },
      {
        "host_id": "native_cpp_direct",
        "limit": 5.0,
        "metric": "reset_ms_per_world",
        "mode": "absolute",
        "observed": 0.16764731875,
        "passed": true
      },
      {
        "host_id": "native_cpp_direct",
        "limit": 5000.0,
        "metric": "teardown_ms",
        "mode": "absolute",
        "observed": 530.421645,
        "passed": true
      },
      {
        "host_id": "native_cpp_direct",
        "limit": 67108864.0,
        "metric": "sampled_peak_delta_bytes_per_world",
        "mode": "absolute",
        "observed": 12810880.0,
        "passed": true
      },
      {
        "host_id": "native_cpp_direct",
        "limit": 67108864.0,
        "metric": "peak_rss_delta_bytes_per_world",
        "mode": "absolute",
        "observed": 12788608.0,
        "passed": true
      },
      {
        "host_id": "native_cpp_direct",
        "limit": 4194304.0,
        "metric": "teardown_residual_bytes_per_world",
        "mode": "absolute",
        "observed": 262656.0,
        "passed": true
      },
      {
        "host_id": "python_nanobind",
        "limit": 5000.0,
        "metric": "cold_construct_ms",
        "mode": "absolute",
        "observed": 4575.288789999831,
        "passed": true
      },
      {
        "host_id": "python_nanobind",
        "limit": 5000.0,
        "metric": "warm_construct_ms",
        "mode": "absolute",
        "observed": 4400.319985999886,
        "passed": true
      },
      {
        "host_id": "python_nanobind",
        "limit": 5000.0,
        "metric": "setup_ms",
        "mode": "absolute",
        "observed": 206.61270600066928,
        "passed": true
      },
      {
        "host_id": "python_nanobind",
        "limit": 5.0,
        "metric": "step_ms_per_world",
        "mode": "absolute",
        "observed": 0.19248095312605074,
        "passed": true
      },
      {
        "host_id": "python_nanobind",
        "limit": 5.0,
        "metric": "reset_ms_per_world",
        "mode": "absolute",
        "observed": 0.16359676874344586,
        "passed": true
      },
      {
        "host_id": "python_nanobind",
        "limit": 5000.0,
        "metric": "teardown_ms",
        "mode": "absolute",
        "observed": 563.1407910004782,
        "passed": true
      },
      {
        "host_id": "python_nanobind",
        "limit": 67108864.0,
        "metric": "sampled_peak_delta_bytes_per_world",
        "mode": "absolute",
        "observed": 13367552.0,
        "passed": true
      },
      {
        "host_id": "python_nanobind",
        "limit": 67108864.0,
        "metric": "peak_rss_delta_bytes_per_world",
        "mode": "absolute",
        "observed": 13318784.0,
        "passed": true
      },
      {
        "host_id": "python_nanobind",
        "limit": 4194304.0,
        "metric": "teardown_residual_bytes_per_world",
        "mode": "absolute",
        "observed": 198400.0,
        "passed": true
      },
      {
        "host_id": "python_nanobind",
        "limit": 30885.712384,
        "metric": "cold_construct_ms",
        "mode": "python_vs_native",
        "observed": 4575.288789999831,
        "passed": true
      },
      {
        "host_id": "python_nanobind",
        "limit": 30713.105568,
        "metric": "warm_construct_ms",
        "mode": "python_vs_native",
        "observed": 4400.319985999886,
        "passed": true
      },
      {
        "host_id": "python_nanobind",
        "limit": 2459.832064,
        "metric": "setup_ms",
        "mode": "python_vs_native",
        "observed": 206.61270600066928,
        "passed": true
      },
      {
        "host_id": "python_nanobind",
        "limit": 2.3083224531249997,
        "metric": "step_ms_per_world",
        "mode": "python_vs_native",
        "observed": 0.19248095312605074,
        "passed": true
      },
      {
        "host_id": "python_nanobind",
        "limit": 2.6764731875,
        "metric": "reset_ms_per_world",
        "mode": "python_vs_native",
        "observed": 0.16359676874344586,
        "passed": true
      },
      {
        "host_id": "python_nanobind",
        "limit": 5243.37316,
        "metric": "teardown_ms",
        "mode": "python_vs_native",
        "observed": 563.1407910004782,
        "passed": true
      },
      {
        "host_id": "python_nanobind",
        "limit": 84797952.0,
        "metric": "sampled_peak_delta_bytes_per_world",
        "mode": "python_vs_native",
        "observed": 13367552.0,
        "passed": true
      },
      {
        "host_id": "python_nanobind",
        "limit": 84708864.0,
        "metric": "peak_rss_delta_bytes_per_world",
        "mode": "python_vs_native",
        "observed": 13318784.0,
        "passed": true
      },
      {
        "host_id": "python_nanobind",
        "limit": 5244928.0,
        "metric": "teardown_residual_bytes_per_world",
        "mode": "python_vs_native",
        "observed": 198400.0,
        "passed": true
      }
    ],
    "status": "pass"
  },